{
  "$schema": "https://json-schema.org/draft/2020-12/schema",
  "$id": "https://packages.keysharp.org/schemas/port.schema.json",
  "title": "Source-hosted package",
  "description": "packages/<owner>/<name>/port.json — present only for packages whose maintained source lives in this repository. It carries what packing needs; the package-level record stays in package.json.",
  "type": "object",
  "required": ["schema", "version", "entry", "engines", "platforms"],
  "additionalProperties": false,
  "properties": {
    "schema": { "const": 1 },
    "version": {
      "type": "string",
      "description": "SemVer of the current source. Changing any file under src/ requires changing this, and the matching versions/<version>-r1.json must ship in the same pull request."
    },
    "entry": {
      "type": "string",
      "description": "Repository-relative, e.g. src/FindText.ks. The same path in every platform's artifact: a platform/<rid>/ overlay replaces files inside src/ rather than living beside it."
    },
    "engines": {
      "type": "object",
      "minProperties": 1,
      "additionalProperties": false,
      "properties": {
        "keysharp": { "type": "string" },
        "autohotkey": { "type": "string" }
      }
    },
    "platforms": {
      "type": "array",
      "minItems": 1,
      "description": "One artifact is built per entry, and a platform/<rid>/ directory must have its rid listed here or nothing in it would ever ship. A machine resolves the most specific artifact available, falling back architecture -> operating system -> any (linux-arm64, then linux, then any). Prefer the OS tier (win, linux, osx) for scripts, which vary by OS and not by architecture; use the architecture ids for native payloads, which do. Do not use 'any' as a stand-in for one platform: a machine whose OS you did not list will resolve it.",
      "items": { "enum": ["any", "win", "linux", "osx", "win-x64", "win-arm64", "linux-x64", "linux-arm64", "osx-x64", "osx-arm64"] }
    },
    "capabilities": { "type": "array", "items": { "type": "string" } },
    "dependencies": { "type": "object", "additionalProperties": { "type": "string" } },
    "setup": {
      "$ref": "https://packages.keysharp.org/schemas/version.schema.json#/$defs/setupNote",
      "description": "A step the user must perform after installing. Printed by install; performed only by `kpm setup`, which shows the exact command and asks first. Carried through to every release manifest built from this port."
    },
    "upstream": {
      "type": "object",
      "description": "The revision this port was cut from, so a maintainer can diff against it later.",
      "additionalProperties": false,
      "properties": {
        "kind": { "enum": ["ports", "git", "scripthub", "forum"] },
        "repository": { "type": "string" },
        "commit": { "type": "string" },
        "path": { "type": "string" },
        "url": { "type": "string" }
      }
    }
  }
}
