{
  "schema": 1,
  "version": "0.1.0",
  "entry": "src/Interception.ks",
  "engines": {
    "keysharp": ">=0.0.0.18"
  },
  "platforms": ["win-x64"],
  "capabilities": [],
  "dependencies": {},
  "setup": {
    "message": "Installs the Interception keyboard and mouse driver, which this package needs. It is a third-party kernel driver that sits below every keyboard and mouse on this PC until it is uninstalled (native/setup/install-interception.exe /uninstall as administrator, then a restart). Needs administrator rights and a restart. Free for non-commercial use only; commercial use needs a licence from its author.",
    "url": "https://github.com/oblitum/Interception#driver-installation",
    "script": "native/setup/install-interception.exe",
    "arguments": ["/install"],
    "elevate": true,
    "reboot": true,
    "platforms": ["win-x64"]
  }
}
